{
  "version": "pricing-os-v1",
  "currency": "KRW",
  "price_bands": [
    { "service_id": "logo-design", "minimum": "25만", "standard": "35만", "premium": "70만+", "minimum_project_fee": "25만 원", "pricing_model": "starting_price", "basis": "시안 수, 응용물, 가이드 범위" },
    { "service_id": "landing-basic", "minimum": "39만", "standard": "69만", "premium": "150만+", "minimum_project_fee": "39만 원", "pricing_model": "package", "basis": "섹션 수, 카피 작성, 폼/GA/GTM, 인터랙션" },
    { "service_id": "brand-landing", "minimum": "80만", "standard": "120만", "premium": "250만+", "minimum_project_fee": "80만 원", "pricing_model": "package", "basis": "기획, 카피, 디자인, 구현 범위" },
    { "service_id": "framer-brand-page", "minimum": "최소 79만", "standard": "120만", "premium": "250만+", "minimum_project_fee": "79만 원", "pricing_model": "page_based", "basis": "페이지 수, CMS, 다국어, 인터랙션, 도메인 연결" },
    { "service_id": "homepage-builder", "minimum": "100만", "standard": "150만", "premium": "250만+", "minimum_project_fee": "100만 원", "pricing_model": "project_based", "basis": "3~5p 소개형, 고객 자료 제공, 템플릿 활용" },
    { "service_id": "homepage-cms", "minimum": "150만", "standard": "250만", "premium": "500만+", "minimum_project_fee": "150만 원", "pricing_model": "project_based", "basis": "5~10p, 기본 CMS, API 3개 미만" },
    { "service_id": "business-web-solution", "minimum": "500만", "standard": "800만", "premium": "1,500만+", "minimum_project_fee": "500만 원", "pricing_model": "project_based", "basis": "관리자, API, DB, 커스텀 기능" },
    { "service_id": "company-profile-brochure-edit", "minimum": "80만", "standard": "100만", "premium": "120만+", "minimum_project_fee": "80만 원", "pricing_model": "project_based", "basis": "30p 이내, 원고/이미지 제공, 디자인 편집 중심" },
    { "service_id": "company-profile-brochure-planning", "minimum": "150만", "standard": "220만", "premium": "300만+", "minimum_project_fee": "150만 원", "pricing_model": "project_based", "basis": "목차, 정보구조, 카피 정리, 페이지 흐름 설계" },
    { "service_id": "brand-kit", "minimum": "100만", "standard": "150만", "premium": "300만+", "minimum_project_fee": "100만 원", "pricing_model": "package", "basis": "로고, 컬러, 폰트, 기본 가이드" },
    { "service_id": "content-planning", "minimum": "50만", "standard": "80만", "premium": "150만+", "minimum_project_fee": "50만 원", "pricing_model": "package", "basis": "1개월 캘린더, 메시지 프레임, 카피 초안" },
    { "service_id": "monthly-content-operation", "minimum": "100만", "standard": "150만", "premium": "300만+", "minimum_project_fee": "100만 원", "pricing_model": "retainer", "basis": "월 8~12건 또는 월 10회 이내" },
    { "service_id": "influencer-marketing", "minimum": "20만+실비", "standard": "30만+실비", "premium": "60만+실비", "minimum_project_fee": "20만 원 + 실비", "pricing_model": "cost_plus", "basis": "1인 섭외, 가이드, 업로드 관리" },
    { "service_id": "ai-media-production", "minimum": "30만", "standard": "80만", "premium": "150만+", "minimum_project_fee": "30만 원", "pricing_model": "starting_price", "basis": "생성/수정 횟수, 상업 사용 가능성, 민감 업종 기준" },
    { "service_id": "homepage-content-finish", "minimum": "100만", "standard": "150만", "premium": "300만+", "minimum_project_fee": "100만 원", "pricing_model": "project_based", "basis": "더미 데이터 교체, 콘텐츠 정리, Framer 적용 범위" },
    { "service_id": "logo-ci-scope", "minimum": "25만", "standard": "35만", "premium": "70만+", "minimum_project_fee": "25만 원", "pricing_model": "starting_price", "basis": "기존 로고 유지, 리터칭, 변경 판단 범위" }
  ],
  "extra_cost_triggers": [
    "페이지 추가",
    "섹션 추가",
    "원고 신규 작성",
    "기술 원고 정리",
    "번역",
    "이미지 보정",
    "AI 이미지 추가 생성",
    "촬영 디렉팅",
    "로고 변경",
    "신규 로고",
    "홈페이지 기능 추가",
    "폼/지도/예약 기능",
    "CMS",
    "API",
    "DB 수집",
    "SEO/GEO 세부 세팅",
    "SNS 운영",
    "인플루언서/체험단 운영",
    "긴급 일정",
    "피드백 초과",
    "방향 변경",
    "의사결정자 변경"
  ]
}
